{
  "kind": "PHILOSOPHER",
  "stub": true,
  "id": "nozick",
  "name": { "fr": "Nozick", "en": "Nozick" },
  "summary": {
    "fr": "Philosophe américain libertarien : il fait des droits individuels des limites infranchissables et tient toute redistribution forcée pour une violation de la propriété de soi.",
    "en": "American libertarian philosopher: he treats individual rights as inviolable side-constraints and holds any coerced redistribution to be a violation of self-ownership."
  },
  "nationality": { "fr": "Américain", "en": "American" },
  "birth": 1938,
  "death": 2002,
  "movements": [],
  "updatedAt": "2026-06-21T00:00:00.000Z",
  "validation": { "method": "NOT_VALIDATED" }
}
