{
  "kind": "PHILOSOPHER",
  "id": "avicenna",
  "stub": true,
  "name": {
    "fr": "Avicenne",
    "en": "Avicenna"
  },
  "summary": {
    "fr": "Philosophe et médecin persan de l'âge d'or islamique, principal interprète d'Aristote en terre d'islam ; sa distinction entre l'essence et l'existence et sa preuve de l'être nécessaire ont profondément marqué la scolastique latine, dont Thomas d'Aquin.",
    "en": "Persian philosopher and physician of the Islamic Golden Age, the foremost interpreter of Aristotle in the Islamic world; his distinction between essence and existence and his proof of the necessary being deeply shaped Latin Scholasticism, Aquinas included."
  },
  "birth": 980,
  "death": 1037,
  "nationality": {
    "fr": "Persan",
    "en": "Persian"
  },
  "movements": [
    "aristotelianism"
  ],
  "updatedAt": "2026-06-29T00:00:00.000Z",
  "validation": {
    "method": "NOT_VALIDATED"
  }
}
