{
  "kind": "PHILOSOPHER",
  "stub": true,
  "id": "fichte",
  "name": { "fr": "Fichte", "en": "Fichte" },
  "fullName": { "fr": "Johann Gottlieb Fichte", "en": "Johann Gottlieb Fichte" },
  "summary": {
    "fr": "Premier des idéalistes allemands, il refonde le criticisme de Kant en une doctrine du Moi qui se pose lui-même et pose le monde comme son obstacle : la liberté agissante, non la chose, est le principe de tout savoir.",
    "en": "The first of the German idealists, he recasts Kant's criticism into a doctrine of the I that posits itself and posits the world as its obstacle: acting freedom, not the thing, is the principle of all knowledge."
  },
  "nationality": { "fr": "Allemand", "en": "German" },
  "birth": 1762,
  "death": 1814,
  "movements": ["german-idealism"],
  "updatedAt": "2026-07-03T00:00:00.000Z",
  "validation": { "method": "NOT_VALIDATED" }
}
