{
  "kind": "PHILOSOPHER",
  "stub": true,
  "id": "popper",
  "name": { "fr": "Popper", "en": "Popper" },
  "summary": {
    "fr": "Philosophe des sciences austro-britannique : il tient une théorie pour scientifique seulement si elle s'expose à la réfutation, et défend un réalisme où la connaissance progresse vers la vérité.",
    "en": "Austrian-British philosopher of science: he holds a theory to be scientific only if it exposes itself to refutation, and defends a realism in which knowledge progresses toward truth."
  },
  "nationality": { "fr": "Austro-britannique", "en": "Austrian-British" },
  "birth": 1902,
  "death": 1994,
  "movements": [],
  "updatedAt": "2026-06-22T00:00:00.000Z",
  "validation": { "method": "NOT_VALIDATED" }
}
